### ISSUE TITLE
Slow speeds on jumper DPI

### ISSUE THREAD

**Issue by yoonsikp** [one-d-wide/yggdrasil-jumper#6]
I'm only getting 1Mbit speeds with a lot of retransmissions on iperf3. (macOS is sending data, Linux is receiving)

From the tcpdump data, I think the issue is that there the jumper DPI packets are not being properly reconstructed on the receiving end. I haven't been able to do the full decode of the packet data yet, but I should be able to at some point in the future. One possible guess, perhaps there is an IPv6 fragmentation  bug ([client side frag](https://en.wikipedia.org/wiki/IPv6_packet#Fragmentation))

It's hard to say without doing the full packet decode. 

macOS sender - iperf3 with 4 TCP packets of size 1240:
```
18:23:52.907059 IP6 (flowlabel 0xb0b00, hlim 64, next-header TCP (6) payload length: 1240) 200:d8ea:f473:fd5f:8a8b:d299:d84e:e45d.5201 > 206:ce06:5aa7:13df:e565:9a0c:b936:7c48.41376: Flags [.], cksum 0xd3e4 (correct), seq 230729:231937, ack 38, win 2058, options [nop,nop,TS val 1553038001 ecr 3646692713], length 1208
18:23:52.907081 IP6 (flowlabel 0xb0b00, hlim 64, next-header TCP (6) payload length: 1240) 200:d8ea:f473:fd5f:8a8b:d299:d84e:e45d.5201 > 206:ce06:5aa7:13df:e565:9a0c:b936:7c48.41376: Flags [.], cksum 0x0fb2 (correct), seq 231937:233145, ack 38, win 2058, options [nop,nop,TS val 1553038001 ecr 3646692713], length 1208
18:23:52.907095 IP6 (flowlabel 0xb0b00, hlim 64, next-header TCP (6) payload length: 1240) 200:d8ea:f473:fd5f:8a8b:d299:d84e:e45d.5201 > 206:ce06:5aa7:13df:e565:9a0c:b936:7c48.41376: Flags [.], cksum 0xff6c (correct), seq 233145:234353, ack 38, win 2058, options [nop,nop,TS val 1553038001 ecr 3646692713], length 1208
18:23:52.907113 IP6 (flowlabel 0xb0b00, hlim 64, next-header TCP (6) payload length: 1240) 200:d8ea:f473:fd5f:8a8b:d299:d84e:e45d.5201 > 206:ce06:5aa7:13df:e565:9a0c:b936:7c48.41376: Flags [.], cksum 0x8f60 (correct), seq 234353:235561, ack 38, win 2058, options [nop,nop,TS val 1553038001 ecr 3646692713], length 1208
```

macOS - yggdrasil (62037) to jumper (62036) - 2 LARGE TCP packets sent through stream 
```
18:23:52.906789 IP (tos 0x0, ttl 64, id 0, offset 0, flags [DF], proto TCP (6), length 249, bad cksum 0 (->3bfd)!)
    127.0.0.1.62036 > 127.0.0.1.62037: Flags [P.], cksum 0xfeed (incorrect -> 0x836d), seq 4015691:4015888, ack 3816966, win 6008, options [nop,nop,TS val 552744768 ecr 1990161750], length 197
18:23:52.906858 IP (tos 0x0, ttl 64, id 0, offset 0, flags [DF], proto TCP (6), length 52, bad cksum 0 (->3cc2)!)
    127.0.0.1.62037 > 127.0.0.1.62036: Flags [.], cksum 0xfe28 (incorrect -> 0x2d71), seq 3816966, ack 4015888, win 21439, options [nop,nop,TS val 1990161774 ecr 552744768], length 0
18:23:52.907164 IP (tos 0x0, ttl 64, id 0, offset 0, flags [DF], proto TCP (6), length 2862, bad cksum 0 (->31c8)!)
    127.0.0.1.62037 > 127.0.0.1.62036: Flags [P.], cksum 0x0923 (incorrect -> 0xe12d), seq 3816966:3819776, ack 4015888, win 21439, options [nop,nop,TS val 1990161774 ecr 552744768], length 2810
18:23:52.907210 IP (tos 0x0, ttl 64, id 0, offset 0, flags [DF], proto TCP (6), length 2862, bad cksum 0 (->31c8)!)
    127.0.0.1.62037 > 127.0.0.1.62036: Flags [P.], cksum 0x0923 (incorrect -> 0xbb7e), seq 3819776:3822586, ack 4015888, win 21439, options [nop,nop,TS val 1990161774 ecr 552744768], length 2810
18:23:52.907402 IP (tos 0x0, ttl 64, id 0, offset 0, flags [DF], proto TCP (6), length 52, bad cksum 0 (->3cc2)!)
    127.0.0.1.62036 > 127.0.0.1.62037: Flags [.], cksum 0xfe28 (incorrect -> 0x541b), seq 4015888, ack 3822586, win 5921, options [nop,nop,TS val 552744768 ecr 1990161774], length 0
```

macOS - jumper to WAN - weird UDP packet lengths ...
```
18:23:52.907265 IP (tos 0x0, ttl 64, id 42211, offset 0, flags [none], proto UDP (17), length 1433)
    172.20.10.3.51565 > 173.32.120.80.46661: [udp sum ok] UDP, length 1405
18:23:52.907310 IP (tos 0x0, ttl 64, id 29742, offset 0, flags [none], proto UDP (17), length 695)
    172.20.10.3.51565 > 173.32.120.80.46661: [udp sum ok] UDP, length 667
18:23:52.907385 IP (tos 0x0, ttl 64, id 23369, offset 0, flags [none], proto UDP (17), length 1428)
    172.20.10.3.51565 > 173.32.120.80.46661: [udp sum ok] UDP, length 1400
18:23:52.907401 IP (tos 0x0, ttl 64, id 57318, offset 0, flags [none], proto UDP (17), length 724)
    172.20.10.3.51565 > 173.32.120.80.46661: [udp sum ok] UDP, length 696
18:23:52.907455 IP (tos 0x0, ttl 64, id 32644, offset 0, flags [none], proto UDP (17), length 1433)
    172.20.10.3.51565 > 173.32.120.80.46661: [udp sum ok] UDP, length 1405
18:23:52.907498 IP (tos 0x0, ttl 64, id 27121, offset 0, flags [none], proto UDP (17), length 171)
    172.20.10.3.51565 > 173.32.120.80.46661: [udp sum ok] UDP, length 143
```
Interestingly, 695 + 724 + 171 = 1590 which is close to the other packet lengths

LINUX - WAN to jumper - ALL UDP PACKETS RECEIVED
```
18:23:52.924375 IP (tos 0x50, ttl 53, id 42211, offset 0, flags [none], proto UDP (17), length 1433)
    24.114.69.50.60598 > 172.16.0.100.46661: [udp sum ok] UDP, length 1405
18:23:52.924375 IP (tos 0x50, ttl 53, id 29742, offset 0, flags [none], proto UDP (17), length 695)
    24.114.69.50.60598 > 172.16.0.100.46661: [udp sum ok] UDP, length 667
18:23:52.924375 IP (tos 0x50, ttl 53, id 23369, offset 0, flags [none], proto UDP (17), length 1428)
    24.114.69.50.60598 > 172.16.0.100.46661: [udp sum ok] UDP, length 1400
18:23:52.924375 IP (tos 0x50, ttl 53, id 57318, offset 0, flags [none], proto UDP (17), length 724)
    24.114.69.50.60598 > 172.16.0.100.46661: [udp sum ok] UDP, length 696
18:23:52.924376 IP (tos 0x50, ttl 53, id 32644, offset 0, flags [none], proto UDP (17), length 1433)
    24.114.69.50.60598 > 172.16.0.100.46661: [udp sum ok] UDP, length 1405
18:23:52.924376 IP (tos 0x50, ttl 53, id 27121, offset 0, flags [none], proto UDP (17), length 171)
    24.114.69.50.60598 > 172.16.0.100.46661: [udp sum ok] UDP, length 143
```

LINUX - jumper (62037) to yggdrasil (62036) - TCP stream
```
18:23:52.924615 IP (tos 0x0, ttl 64, id 1058, offset 0, flags [DF], proto TCP (6), length 1457)
    127.0.0.1.45951 > 127.0.0.1.34390: Flags [P.], cksum 0x03a6 (incorrect -> 0x60f8), seq 4199438:4200843, ack 7472025, win 10729, options [nop,nop,TS val 286974546 ecr 286974517], length 1405
18:23:52.924743 IP (tos 0x0, ttl 64, id 1059, offset 0, flags [DF], proto TCP (6), length 695)
    127.0.0.1.45951 > 127.0.0.1.34390: Flags [P.], cksum 0x00ac (incorrect -> 0xa574), seq 4200843:4201486, ack 7472025, win 10729, options [nop,nop,TS val 286974546 ecr 286974517], length 643
18:23:52.924840 IP (tos 0x0, ttl 64, id 39525, offset 0, flags [DF], proto TCP (6), length 52)
    127.0.0.1.34390 > 127.0.0.1.45951: Flags [.], cksum 0xfe28 (incorrect -> 0x5df9), seq 7472025, ack 4201486, win 47386, options [nop,nop,TS val 286974546 ecr 286974546], length 0
18:23:52.924919 IP (tos 0x0, ttl 64, id 1060, offset 0, flags [DF], proto TCP (6), length 1428)
    127.0.0.1.45951 > 127.0.0.1.34390: Flags [P.], cksum 0x0389 (incorrect -> 0xa91b), seq 4201486:4202862, ack 7472025, win 10729, options [nop,nop,TS val 286974546 ecr 286974546], length 1376
18:23:52.925008 IP (tos 0x0, ttl 64, id 1061, offset 0, flags [DF], proto TCP (6), length 724)
    127.0.0.1.45951 > 127.0.0.1.34390: Flags [P.], cksum 0x00c9 (incorrect -> 0x2c85), seq 4202862:4203534, ack 7472025, win 10729, options [nop,nop,TS val 286974546 ecr 286974546], length 672
18:23:52.925105 IP (tos 0x0, ttl 64, id 1062, offset 0, flags [DF], proto TCP (6), length 171)
    127.0.0.1.45951 > 127.0.0.1.34390: Flags [P.], cksum 0xfe9f (incorrect -> 0x5dce), seq 4203534:4203653, ack 7472025, win 10729, options [nop,nop,TS val 286974546 ecr 286974546], length 119
18:23:52.925362 IP (tos 0x0, ttl 64, id 39526, offset 0, flags [DF], proto TCP (6), length 52)
    127.0.0.1.34390 > 127.0.0.1.45951: Flags [.], cksum 0xfe28 (incorrect -> 0x5591), seq 7472025, ack 4203653, win 47370, options [nop,nop,TS val 286974547 ecr 286974546], length 0
```

5817 (macOS) vs 4215 (Linux) on the TCP stream (something's probably been lost here)

LINUX - yggdrasil to iperf3 client ONLY 3 out of 4 packets received

```
18:23:52.925306 IP6 (flowlabel 0xb0b00, hlim 64, next-header TCP (6) payload length: 1240) 200:d8ea:f473:fd5f:8a8b:d299:d84e:e45d.5201 > 206:ce06:5aa7:13df:e565:9a0c:b936:7c48.41376: Flags [.], cksum 0xd3e4 (correct), seq 230729:231937, ack 38, win 2058, options [nop,nop,TS val 1553038001 ecr 3646692713], length 1208
18:23:52.925360 IP6 (flowlabel 0xd7399, hlim 64, next-header TCP (6) payload length: 32) 206:ce06:5aa7:13df:e565:9a0c:b936:7c48.41376 > 200:d8ea:f473:fd5f:8a8b:d299:d84e:e45d.5201: Flags [.], cksum 0xda3b (incorrect -> 0x0c67), seq 38, ack 231937, win 559, options [nop,nop,TS val 3646692744 ecr 1553037977], length 0
18:23:52.925417 IP6 (flowlabel 0xb0b00, hlim 64, next-header TCP (6) payload length: 1240) 200:d8ea:f473:fd5f:8a8b:d299:d84e:e45d.5201 > 206:ce06:5aa7:13df:e565:9a0c:b936:7c48.41376: Flags [.], cksum 0x0fb2 (correct), seq 231937:233145, ack 38, win 2058, options [nop,nop,TS val 1553038001 ecr 3646692713], length 1208
18:23:52.925541 IP6 (flowlabel 0xb0b00, hlim 64, next-header TCP (6) payload length: 1240) 200:d8ea:f473:fd5f:8a8b:d299:d84e:e45d.5201 > 206:ce06:5aa7:13df:e565:9a0c:b936:7c48.41376: Flags [.], cksum 0xff6c (correct), seq 233145:234353, ack 38, win 2058, options [nop,nop,TS val 1553038001 ecr 3646692713], length 1208
18:23:52.925664 IP6 (flowlabel 0xd7399, hlim 64, next-header TCP (6) payload length: 32) 206:ce06:5aa7:13df:e565:9a0c:b936:7c48.41376 > 200:d8ea:f473:fd5f:8a8b:d299:d84e:e45d.5201: Flags [.], cksum 0xda3b (incorrect -> 0x02d6), seq 38, ack 234353, win 568, options [nop,nop,TS val 3646692744 ecr 1553038001], length 0
18:23:52.965781 IP6 (flowlabel 0xb0b00, hlim 64, next-header TCP (6) payload length: 1240) 200:d8ea:f473:fd5f:8a8b:d299:d84e:e45d.5201 > 206:ce06:5aa7:13df:e565:9a0c:b936:7c48.41376: Flags [.], cksum 0xfc5f (correct), seq 235561:236769, ack 38, win 2058, options [nop,nop,TS val 1553038031 ecr 3646692744], length 1208
18:23:52.965829 IP6 (flowlabel 0xd7399, hlim 64, next-header TCP (6) payload length: 44) 206:ce06:5aa7:13df:e565:9a0c:b936:7c48.41376 > 200:d8ea:f473:fd5f:8a8b:d299:d84e:e45d.5201: Flags [.], cksum 0xda47 (incorrect -> 0x4a5b), seq 38, ack 234353, win 568, options [nop,nop,TS val 3646692784 ecr 1553038001,nop,nop,sack 1 {235561:236769}], length 0
18:23:52.965856 IP6 (flowlabel 0xb0b00, hlim 64, next-header TCP (6) payload length: 1240) 200:d8ea:f473:fd5f:8a8b:d299:d84e:e45d.5201 > 206:ce06:5aa7:13df:e565:9a0c:b936:7c48.41376: Flags [.], cksum 0xc32e (correct), seq 236769:237977, ack 38, win 2058, options [nop,nop,TS val 1553038031 ecr 3646692744], length 1208
18:23:52.965875 IP6 (flowlabel 0xd7399, hlim 64, next-header TCP (6) payload length: 44) 206:ce06:5aa7:13df:e565:9a0c:b936:7c48.41376 > 200:d8ea:f473:fd5f:8a8b:d299:d84e:e45d.5201: Flags [.], cksum 0xda47 (incorrect -> 0x45a3), seq 38, ack 234353, win 568, options [nop,nop,TS val 3646692784 ecr 1553038001,nop,nop,sack 1 {235561:237977}], length 0
18:23:52.966020 IP6 (flowlabel 0xb0b00, hlim 64, next-header TCP (6) payload length: 1240) 200:d8ea:f473:fd5f:8a8b:d299:d84e:e45d.5201 > 206:ce06:5aa7:13df:e565:9a0c:b936:7c48.41376: Flags [.], cksum 0x6db4 (correct), seq 237977:239185, ack 38, win 2058, options [nop,nop,TS val 1553038031 ecr 3646692744], length 1208
18:23:52.966071 IP6 (flowlabel 0xd7399, hlim 64, next-header TCP (6) payload length: 44) 206:ce06:5aa7:13df:e565:9a0c:b936:7c48.41376 > 200:d8ea:f473:fd5f:8a8b:d299:d84e:e45d.5201: Flags [.], cksum 0xda47 (incorrect -> 0x40eb), seq 38, ack 234353, win 568, options [nop,nop,TS val 3646692784 ecr 1553038001,nop,nop,sack 1 {235561:239185}], length 0
18:23:52.966100 IP6 (flowlabel 0xb0b00, hlim 64, next-header TCP (6) payload length: 1240) 200:d8ea:f473:fd5f:8a8b:d299:d84e:e45d.5201 > 206:ce06:5aa7:13df:e565:9a0c:b936:7c48.41376: Flags [.], cksum 0x656b (correct), seq 240393:241601, ack 38, win 2058, options [nop,nop,TS val 1553038031 ecr 3646692744], length 1208
18:23:52.967281 IP6 (flowlabel 0xd7399, hlim 64, next-header TCP (6) payload length: 52) 206:ce06:5aa7:13df:e565:9a0c:b936:7c48.41376 > 200:d8ea:f473:fd5f:8a8b:d299:d84e:e45d.5201: Flags [.], cksum 0xda4f (incorrect -> 0x78df), seq 38, ack 234353, win 568, options [nop,nop,TS val 3646692784 ecr 1553038001,nop,nop,sack 2 {240393:241601}{235561:239185}], length 0
18:23:52.990276 IP6 (flowlabel 0xb0b00, hlim 64, next-header TCP (6) payload length: 1240) 200:d8ea:f473:fd5f:8a8b:d299:d84e:e45d.5201 > 206:ce06:5aa7:13df:e565:9a0c:b936:7c48.41376: Flags [.], cksum 0x2cbc (correct), seq 241601:242809, ack 38, win 2058, options [nop,nop,TS val 1553038072 ecr 3646692784], length 1208
18:23:52.990348 IP6 (flowlabel 0xb0b00, hlim 64, next-header TCP (6) payload length: 1240) 200:d8ea:f473:fd5f:8a8b:d299:d84e:e45d.5201 > 206:ce06:5aa7:13df:e565:9a0c:b936:7c48.41376: Flags [.], cksum 0x0909 (correct), seq 242809:244017, ack 38, win 2058, options [nop,nop,TS val 1553038072 ecr 3646692784], length 1208
18:23:52.990636 IP6 (flowlabel 0xb0b00, hlim 64, next-header TCP (6) payload length: 1240) 200:d8ea:f473:fd5f:8a8b:d299:d84e:e45d.5201 > 206:ce06:5aa7:13df:e565:9a0c:b936:7c48.41376: Flags [.], cksum 0x8ed2 (correct), seq 234353:235561, ack 38, win 2058, options [nop,nop,TS val 1553038072 ecr 3646692784], length 1208
18:23:52.990706 IP6 (flowlabel 0xd7399, hlim 64, next-header TCP (6) payload length: 44) 206:ce06:5aa7:13df:e565:9a0c:b936:7c48.41376 > 200:d8ea:f473:fd5f:8a8b:d299:d84e:e45d.5201: Flags [.], cksum 0xda47 (incorrect -> 0x0810), seq 38, ack 239185, win 531, options [nop,nop,TS val 3646692809 ecr 1553038072,nop,nop,sack 1 {240393:244017}], length 0
18:23:52.990747 IP6 (flowlabel 0xb0b00, hlim 64, next-header TCP (6) payload length: 1240) 200:d8ea:f473:fd5f:8a8b:d299:d84e:e45d.5201 > 206:ce06:5aa7:13df:e565:9a0c:b936:7c48.41376: Flags [.], cksum 0x59d4 (correct), seq 239185:240393, ack 38, win 2058, options [nop,nop,TS val 1553038073 ecr 3646692784], length 1208
18:23:52.990775 IP6 (flowlabel 0xd7399, hlim 64, next-header TCP (6) payload length: 32) 206:ce06:5aa7:13df:e565:9a0c:b936:7c48.41376 > 200:d8ea:f473:fd5f:8a8b:d299:d84e:e45d.5201: Flags [.], cksum 0xda3b (incorrect -> 0xdcd6), seq 38, ack 244017, win 494, options [nop,nop,TS val 3646692809 ecr 1553038073], length 0


```

There is a gap or dropped packet for TCP seq 234353 and 235561.  The retransmission happens at time 18:23:52.990636 when expected at 18:23:52.925541 so approximately a 70ms delay. 

And by the looks of it, another packet appears to have been lost: TCP sequence 239185:240393

so this really is a pattern.

**Comment by yoonsikp** [comment]
An update from the debug log of when packets are dropped:

```
DEBUG {direction="TCP -> UDP"}: Received 4096 bytes from yggdrasil

DEBUG {direction="TCP -> UDP"}: Received packet type is 9
DEBUG {direction="TCP -> UDP"}: Sending 1405 bytes via shortcut

DEBUG {direction="TCP -> UDP"}: Received packet type is 9
DEBUG {direction="TCP -> UDP"}: Sending 1405 bytes via shortcut

DEBUG {direction="TCP -> UDP"}: Too long 1405 bytes

DEBUG {direction="TCP -> UDP"}: Skipped 1286 bytes, 119 remaining

DEBUG {direction="TCP -> UDP"}: Sending 1310 bytes to peer
DEBUG {direction="TCP -> UDP"}: Next update in 32 ms

DEBUG {direction="TCP -> UDP"}: Received 2929 bytes from yggdrasil
DEBUG {direction="TCP -> UDP"}: Skipped 119 bytes, 0 remaining

DEBUG {direction="TCP -> UDP"}: Received packet type is 9
```

I think the issue is there needs to be a small buffer to hold truncated Type 9 traffic packets that don't align with the TCP message boundary? The skip functionality seems to work fine, but the packet is lost. We should be able to merge the truncated packet with the beginning of the next TCP message and reconstruct the packet.

The config I'm using:

```
yggdrasil_dpi = true
yggdrasil_dpi_fallback_to_reliable = false
```

**Comment by one-d-wide** [comment]
NB: dpi feature is [highly experimental](https://github.com/one-d-wide/yggdrasil-jumper#advanced-configuration). I'd recommend digging into wireguard instead. It's much faster latency wise and bandwidth wise, even when compared to the yggdrasil router itself. IIRC wireguard should be supported on macos and windows, but I'm not so sure about the [black magic](https://github.com/one-d-wide/yggdrasil-jumper#bridging-over-wireguard) needed to adjust the firewall state. Anyway, have fun :)

> An update from the debug log of when packets are dropped:
> ```
> DEBUG {direction="TCP -> UDP"}: Received 4096 bytes from yggdrasil
>                                          ^^^^
> DEBUG {direction="TCP -> UDP"}: Received packet type is 9
> DEBUG {direction="TCP -> UDP"}: Sending 1405 bytes via shortcut
> 
> DEBUG {direction="TCP -> UDP"}: Received packet type is 9
> DEBUG {direction="TCP -> UDP"}: Sending 1405 bytes via shortcut
> 
> DEBUG {direction="TCP -> UDP"}: Too long 1405 bytes
> 
> DEBUG {direction="TCP -> UDP"}: Skipped 1286 bytes, 119 remaining
> ```


It looks like it's hitting buffer size 4096 somewhere between yggdraisil -> jumper. I didn't observe half-split packets like this in my testing, that's probably why it simply drops them on `Packet::Truncated(len)`. I think moving the remaining data to the beginning of the tcp buffer as [here](https://github.com/one-d-wide/yggdrasil-jumper/blob/f8a1491a73bf6ba8b047241796d65b7be60afb45/src/yggdrasil_dpi.rs#L144-L146) should be enough, plus a check in case a too big packet fills the [whole buffer](https://github.com/one-d-wide/yggdrasil-jumper/blob/f8a1491a73bf6ba8b047241796d65b7be60afb45/src/proxy_tcp.rs#L20-L20).


> I'm only getting 1Mbit speeds with a lot of retransmissions on iperf3. (macOS is sending data, Linux is receiving)

I obtained very similar results myself even without the apparent packet loss in jumper, which I ended up attributing to [latency fluctuations](https://github.com/one-d-wide/yggdrasil-jumper#latency-fluctuations-with-yggdrasil-dpi).


> One possible guess, perhaps there is an IPv6 fragmentation bug (client side frag)

I don't think so, but you could try setting `yggdrasil_dpi_udp_mtu = 1452 # 1500 (usual mtu) - 40 (ipv6 header) - 8 (udp header)` or some other lower number. With this, you should see this debug [message](https://github.com/one-d-wide/yggdrasil-jumper/blob/f8a1491a73bf6ba8b047241796d65b7be60afb45/src/yggdrasil_dpi.rs#L158) if the udp packet size is exceeded.


> macOS - yggdrasil (62037) to jumper (62036) - 2 LARGE TCP packets sent through stream

Yggdrasil sends all it's traffic over the streaming socket, so it's natural some of the original packets end up bundled together to save on io operations.


> macOS - jumper to WAN - weird UDP packet lengths ...

Jumper decomposes the yggdrasil packets and sends them individually, so they have better chances fitting into the mtu of the underlying network. It doesn't split regular the packets further except for meta/fallback packets, they go via kcp (reliable fallback). So I'm not sure where <1kb packets are coming from. Inferring from the logs below, the 3rd 1208 byte packet was dropped (skipped), so it's probably not that.

**Comment by one-d-wide** [comment]
> I think the issue is there needs to be a small buffer to hold truncated Type 9 traffic packets that don't align with the TCP message boundary? The skip functionality seems to work fine, but the packet is lost. We should be able to merge the truncated packet with the beginning of the next TCP message and reconstruct the packet.

I believe you were right to suspect a bug there. I've implemented proper handling for split packets in v0.4.2, and tcp bandwidth improved considerably under dpi. I'm not sure why I haven't noticed erlier too-long-packets being an often occurrence.

> The skip functionality seems to work fine, but the packet is lost.

As a guess, regularly skipping packets is bad because jumper automatically sends them over kcp, which does it's own delay calculations. If it's packets are often skipped, this effectively separates them into two streams: a fast one (udp bypass) where majority of packets go, and then minority of packets getting delayed sent over the kcp. I can easily imaging this setting off TCP congestion mechanism. And that's also sounds like a possible culprit behind latency fluctuations I described in readme.
